001:003:002:DESCRIPTOR         1612975462.518124
 06 00 FF 09 01 A1 01 15 00 26 FF 00 75 08 85 01
 09 01 95 20 81 02 85 02 09 01 95 20 91 02 85 05
 09 01 95 40 81 02 85 06 09 01 95 40 91 02 85 07
 09 01 95 40 81 02 C0

001:003:001:DESCRIPTOR         1612975462.521290
 05 01 09 06 A1 01 85 01 05 07 19 E0 29 E7 15 00
 25 01 75 01 95 08 81 02 95 01 75 08 15 00 25 65
 05 07 19 00 29 65 81 00 C0 05 0C 09 01 A1 01 85
 02 19 00 2A 3C 02 15 00 26 3C 02 95 01 75 10 81
 00 C0 05 01 09 80 A1 01 85 03 95 01 75 02 15 01
 25 03 09 82 09 81 09 83 81 60 75 06 81 03 C0 05
 0C 09 01 A1 01 85 04 15 00 25 01 75 01 95 01 09
 CD 81 06 0A 83 01 81 06 09 B5 81 06 09 B6 81 06
 0A B8 01 81 06 0A 23 02 81 06 0A 25 02 81 06 0A
 24 02 81 06 C0

001:003:000:DESCRIPTOR         1612975462.524320
 06 00 FF 09 01 A1 01 15 00 26 FF 00 75 08 85 01
 09 01 95 20 81 02 85 02 09 01 95 20 91 02 85 03
 09 01 95 01 81 02 85 04 09 01 95 40 91 02 85 05
 09 01 95 40 81 02 85 06 09 01 95 40 91 02 C0

